"Tabla 18. Estructura empresarial Medellín, según comunas y actividad económica (Total empresas)",,,,,,Volver al índice,,,,,,,,,,,,,,,,,,
,,,,,,,,,,,,,,,,,,,,,,,,
,,,,,,,,,,,,,,,,,,,,,,,,
CIIU,Descripción,ALTAVISTA,ARANJUEZ,BELEN,BUENOS AIRES,CASTILLA,DOCE DE OCTUBRE,EL POBLADO,GUAYABAL,LA AMERICA,LA CANDELARIA,LAURELES,MANRIQUE,PALMITAS,POPULAR,ROBLEDO,SAN ANTONIO DE PRADO,SAN CRISTOBAL,SAN JAVIER,SANTA CRUZ,SANTA ELENA,VILLA HERMOSA,Sin georreferenciar,Total
90,Rentistas de Capital. Solo para personas naturales,,4,17,10,1,2,21,1,3,31,23,2,,1,1,3,,2,1,4,3,0,130
111,"Cultivo de cereales (excepto arroz), legumbres y semillas oleaginosas",,,1,,,,11,1,1,2,,,,,,,,2,,1,3,1,23
112,Cultivo de arroz,,,,,,,,,1,2,2,,,,,1,,,,,,0,6
113,"Cultivo de hortalizas, raíces y tubérculos",,2,9,,,1,12,6,2,1,6,1,,,1,,3,1,,3,2,1,51
115,Cultivo de plantas textiles,,,,,,,1,,,1,,,,,,,,,1,,,0,3
119,Otros cultivos transitorios n.c.p.,,,2,,,,9,,1,1,4,,,,,1,,,,,1,1,20
121,Cultivo de frutas tropicales y subtropicales,1,1,9,7,2,3,102,8,3,16,20,4,,,4,3,,1,,6,3,1,194
122,Cultivo de plátano y banano,1,,5,3,,,65,,,14,10,,,,,,,,1,1,,0,100
123,Cultivo de café,2,2,7,2,,,31,1,3,3,7,,1,,1,2,1,,,1,1,1,66
124,Cultivo de cańa de azúcar,,1,1,,,,3,,1,,1,,,,,1,,,,1,,1,10
125,Cultivo de flor de corte,,,3,1,1,,18,2,1,6,3,,,,,,1,,,,,0,36
126,Cultivo de palma para aceite (palma africana) y otros frutos oleaginosos,3,,1,,1,,20,5,1,3,,,,,,,,,,,1,0,35
127,Cultivo de plantas con las que se preparan bebidas,,,,1,,,3,,,1,2,,,,,,,,,,,0,7
128,Cultivo de especias y de plantas aromáticas y medicinales,,1,8,,1,,31,3,1,7,10,,1,,1,2,,,,3,4,3,76
129,Otros cultivos permanentes n.c.p.,,,1,1,1,,18,1,1,5,2,,,,,,,,,1,1,0,32
130,"Propagación de plantas (actividades de los viveros, excepto viveros forestales)",,3,5,1,4,,14,1,5,5,7,1,,3,3,4,2,3,1,4,1,0,67
141,Cría de ganado bovino y bufalino,11,6,39,24,15,,360,31,13,79,84,,,1,2,6,4,5,1,17,8,8,714
142,Cría de caballos y otros equinos,,1,2,,,,5,3,,3,4,,,,1,,,1,,3,,1,24
143,Cría de ovejas y cabras,,,,,,,1,,,,,,,,,,,,,1,,0,2
144,Cría de ganado porcino,,,9,,3,1,36,7,4,5,8,1,,,3,4,2,,2,1,6,1,93
145,Cría de aves de corral,1,,3,,1,1,3,2,1,8,3,1,,,1,3,1,2,,1,1,1,34
149,Cría de otros animales n.c.p.,,2,1,1,,,6,1,,3,1,1,,,,1,3,1,1,3,1,0,26
150,Explotación mixta (agrícola y pecuaria),2,2,10,5,3,1,95,2,2,13,22,,,,3,2,3,2,1,9,5,3,185
161,Actividades de apoyo a la agricultura,2,6,20,2,2,3,66,6,11,14,21,1,,,7,3,4,2,1,11,,0,182
162,Actividades de apoyo a la ganadería,4,5,5,3,3,1,33,4,10,8,10,,,,2,,1,1,,3,3,1,97
163,Actividades posteriores a la cosecha,1,2,3,1,,,8,2,2,1,3,1,,,,,,,,,,0,24
164,Tratamiento de semillas para propagación,,,,,,,3,,,,,,,,,,,,,,,0,3
210,Silvicultura y otras actividades forestales,1,1,3,1,2,,31,4,5,16,6,1,,2,5,,2,2,,3,2,1,88
220,Extracción de madera,,,,1,,,7,,,5,3,,,,1,1,,,,,,1,19
230,Recolección de productos forestales diferentes a la madera,,,1,,1,,,,,,,,,,,,,,,,,0,2
240,Servicios de apoyo a la silvicultura,,1,1,,,,3,2,,1,2,,,,1,,1,,,,,0,12
312,Pesca de agua dulce,,,,,,,,,,1,,,,,,,,,,,,0,1
321,Acuicultura marítima,,,,,,,1,,,,,,,,,,,,,,,0,1
322,Acuicultura de agua dulce,2,1,1,1,1,,4,1,2,9,5,,,,1,1,,,,,1,0,30
510,Extracción de hulla (carbón de piedra),,,,1,1,,6,1,1,2,,,,,,,,,,,,0,12
520,Extracción de carbón lignito,,,,,,,1,,,,,,,,,,,,,,,0,1
721,Extracción de minerales de uranio y de torio,,,,,,,1,,,,,,,,,,,,,,,0,1
722,Extracción de oro y otros metales preciosos,,4,10,3,1,1,87,8,6,26,22,6,,1,2,,1,2,4,2,2,0,188
729,Extracción de otros minerales metalíferos no ferrosos n.c.p.,,,,,,,1,,,2,,2,,,,,,,,,,0,5
811,"Extracción de piedra, arena, arcillas comunes, yeso y anhidrita",1,3,5,3,2,,16,1,,8,8,1,,,1,1,1,2,,2,2,0,57
812,"Extracción de arcillas de uso industrial, caliza, caolín y bentonitas",,,1,,,,4,1,,1,1,,,,,,,1,,,,0,9
820,"Extracción de esmeraldas, piedras preciosas y semipreciosas",,,,,,,1,,,,1,,,,,,,,,,,0,2
891,Extracción de minerales para la fabricación de abonos y productos químicos,,1,,,,,1,,,,,,,,,,,,,,,0,2
892,Extracción de halita (sal),,,,,,,1,,,,,,,,,,,,,,,0,1
899,Extracción de otros minerales no metálicos n.c.p.,,,,,,,3,,,,,,,,,,,,,,,0,3
910,Actividades de apoyo para la extracción de petróleo y de gas natural,,,,1,,,,,,,,,,,1,,,,,,,0,2
990,Actividades de apoyo para otras actividades de explotación de minas y canteras,1,,7,,,,34,3,2,7,6,,,,2,,2,1,,,2,0,67
1011,Procesamiento y conservación de carne y productos cárnicos,,16,13,6,26,6,11,22,10,27,15,4,,2,13,1,2,7,3,1,3,1,189
1012,"Procesamiento y conservación de pescados, crustáceos y moluscos",,,1,,1,,2,2,,2,,,,,,1,,,,,,0,9
1020,"Procesamiento y conservación de frutas, legumbres, hortalizas y tubérculos",1,3,22,17,8,5,29,16,12,19,16,6,,2,8,6,6,5,3,2,9,1,196
1030,(en blanco),,,1,,,,2,3,,1,4,1,,,,1,,,,1,,0,14
1040,Elaboración de productos lácteos,1,7,7,,8,1,15,5,6,7,11,,,1,6,1,1,5,2,1,1,1,87
1051,Elaboración de productos de molinería,3,9,12,4,4,8,2,4,2,10,3,4,,3,6,1,6,2,1,1,3,0,88
1052,Elaboración de almidones y productos derivados del almidón,,1,,,,,,,1,,,,,,,,,,,,,0,2
1061,Trilla de café,,,,1,,,2,2,,1,,,,,,,,,,,,1,7
1062,"Descafeinado, tostión y molienda del café",,1,2,1,1,,5,4,3,2,5,1,1,,1,2,,,,1,2,0,32
1063,Otros derivados del café,,,1,,,,7,2,1,2,3,,,,,,,,1,,,0,17
1071,Elaboración y refinación de azúcar,,,,,,,,,,,,,,,,,,1,,,,0,1
1072,Elaboración de panela,,,4,,,1,2,,,3,3,,,,,,,,,,,0,13
1081,Elaboración de productos de panadería,11,98,127,50,58,58,80,81,71,204,117,39,,36,56,32,24,42,38,20,54,7,1303
1082,"Elaboración de cacao, chocolate y productos de confitería",,1,9,7,,,8,4,1,4,6,3,,,5,,1,1,,2,1,2,55
1083,"Elaboración de macarrones, fideos, alcuzcuz y productos farináceos similares",,,,,,,,1,,1,2,,,,1,,,,,,,0,5
1084,Elaboración de comidas y platos preparados,9,13,53,15,16,15,76,33,37,61,51,11,,6,21,6,5,17,5,10,22,1,483
1089,Elaboración de otros productos alimenticios n.c.p.,9,19,51,15,16,12,54,49,23,42,36,17,1,6,17,8,10,13,8,5,17,1,429
1090,Elaboración de alimentos preparados para animales,,1,7,1,3,,7,11,3,2,3,,,,4,1,2,1,3,2,1,0,52
1101,"Destilación, rectificación y mezcla de bebidas alcohólicas",,2,3,,,,6,,,3,2,,,,,,,1,,,2,0,19
1102,Elaboración de bebidas fermentadas no destiladas,,,1,,,,,2,1,,2,,,,1,,,1,1,,,0,9
1103,"Producción de malta, elaboración de cervezas y otras bebidas malteadas",2,,,2,,1,6,5,3,4,6,2,,,3,2,,,,1,1,0,38
1104,"Elaboración de bebidas no alcohólicas, producción de aguas minerales y otras aguas embotelladas",1,3,4,2,,2,12,8,2,6,5,,,,,,,2,2,4,2,0,55
1311,Preparación e hilatura de fibras textiles,,2,,1,1,,2,4,,5,,,,,2,1,,2,1,,,0,21
1312,Tejeduría de productos textiles,,,5,2,2,2,4,11,4,18,6,1,,,,1,,5,,1,2,0,64
1313,Acabado de productos textiles,3,14,42,18,16,12,15,50,14,114,20,5,,3,5,6,11,17,6,2,11,1,385
1391,Fabricación de tejidos de punto y ganchillo,1,,2,,2,,4,7,1,6,3,,,,2,,,,1,,,0,29
1392,"Confección de artículos con materiales textiles, excepto prendas de vestir",2,7,17,5,7,4,11,18,9,21,18,2,,1,7,5,4,3,5,1,5,1,153
1393,Fabricación de tapetes y alfombras para pisos,,,,,1,,,,,,1,,,,,,,1,,1,,0,4
1394,"Fabricación de cuerdas, cordeles, cables, bramantes y redes",,,2,1,2,,,2,1,3,1,,,,,,,,,,1,0,13
1399,Fabricación de otros artículos textiles n.c.p.,2,3,11,8,7,3,13,16,11,30,17,3,,2,1,4,1,4,2,1,2,0,141
1410,"Confección de prendas de vestir, excepto prendas de piel",23,115,327,96,103,73,253,327,144,1024,297,59,1,24,104,50,25,90,35,25,82,13,3290
1420,Fabricación de artículos de piel,,,,,1,1,3,1,,2,1,1,,,,1,,,,,1,0,12
1430,Fabricación de artículos de punto y ganchillo,,,2,,1,,1,2,,3,,,,,,,,,,1,,0,10
1511,"Curtido y recurtido de cueros, recurtido y teńido de pieles",,,,1,,,2,1,,1,,,,,,,,1,,,,0,6
1512,"Fabricación de artículos de viaje, bolsos de mano y artículos similares elaborados en cuero, y fabricación de artículos de talabartería y guarnicionería",,5,8,4,9,1,12,5,2,18,7,1,,2,3,1,3,4,,,,0,85
1513,"Fabricación de artículos de viaje, bolsos de mano y artículos similares, artículos de talabartería y guarnicionería elaborados en otros materiales",,4,6,5,3,,7,6,2,12,8,,,,1,2,3,3,1,2,4,0,69
1521,"Fabricación de calzado de cuero y piel, con cualquier tipo de suela",5,8,8,4,3,7,14,17,7,58,8,2,,3,7,1,2,6,5,1,7,0,173
1522,"Fabricación de otros tipos de calzado, excepto calzado de cuero y piel",,3,3,6,2,7,5,2,1,39,2,3,,,,1,1,1,2,,3,0,81
1523,Fabricación de partes del calzado,1,2,2,,2,2,1,7,,6,,,,,,,,,1,,,0,24
1610,"Aserrado, acepillado e impregnación de la madera",1,9,2,2,2,2,7,3,2,37,,1,1,,,3,2,1,3,4,3,1,86
1620,"Fabricación de hojas de madera para enchapado, fabricación de tableros contrachapados, tableros laminados, tableros de partículas y otros tableros y paneles",,1,,,,,1,1,1,3,2,,,1,1,,,,,,1,0,12
1630,"Fabricación de partes y piezas de madera, de carpintería y ebanistería para la construcción",3,20,27,14,7,10,13,22,7,48,11,8,,2,10,6,7,2,9,3,6,0,235
1640,Fabricación de recipientes de madera,,,1,,,,,5,1,,,,,,,,1,,,1,,0,9
1690,"Fabricación de otros productos de madera, fabricación de artículos de corcho, cestería y espartería",,6,2,1,2,2,7,7,3,11,7,2,,,3,2,4,,,1,3,0,63
1701,"Fabricación de pulpas (pastas) celulósicas, papel y cartón",,,,,,,,1,,1,,,,,,,,,,,1,0,3
1702,"Fabricación de papel y cartón ondulado (corrugado), fabricación de envases, empaques y de embalajes de papel y cartón",,1,2,,,,2,4,1,8,6,1,,,,,,,,2,,1,28
1709,Fabricación de otros artículos de papel y cartón,,4,4,1,1,,7,3,4,19,7,,,,1,1,3,1,1,,,0,57
1811,Actividades de impresión,,16,57,8,14,11,38,45,29,281,57,8,,2,17,6,4,9,,2,11,1,616
1812,Actividades de servicios relacionados con la impresión,1,4,8,,4,3,16,25,3,81,18,4,,,2,4,2,2,1,1,5,0,184
1820,Producción de copias a partir de grabaciones originales,1,,1,,,,1,,,,2,,,,,,,,,,,0,5
1910,Fabricación de productos de hornos de coque,,,,,,,,,,1,,,,,,,,,,,,0,1
1921,Fabricación de productos de la refinación del petróleo,,,,,1,,2,2,2,2,,,,,,,1,1,,,,0,11
1922,Actividad de mezcla de combustibles,,,,,,,,,,1,,,,,,,,,,,,0,1
2011,Fabricación de sustancias y productos químicos básicos,,1,5,,1,,10,6,5,4,2,1,,1,,2,,,,,1,1,40
2012,Fabricación de abonos y compuestos inorgánicos nitrogenados,,1,3,,,1,6,2,,1,5,,,,,1,,,1,1,1,0,23
2013,Fabricación de plásticos en formas primarias,,4,3,1,3,,3,9,2,5,1,3,,,3,1,,,2,,,0,40
2014,Fabricación de caucho sintético en formas primarias,,,,,,,,1,,2,1,,,,,,,,,1,,0,5
2021,Fabricación de plaguicidas y otros productos químicos de uso agropecuario,2,1,,1,,,1,1,1,1,2,,,1,1,,,1,,4,,0,17
2022,"Fabricación de pinturas, barnices y revestimientos similares, tintas para impresión y masillas",,3,4,2,3,1,8,4,2,9,7,,,,1,1,1,,1,,,0,47
2023,"Fabricación de jabones y detergentes, preparados para limpiar y pulir, perfumes y preparados de tocador",4,7,30,10,6,7,24,27,9,23,24,6,,1,5,4,2,11,5,7,4,4,220
2029,Fabricación de otros productos químicos n.c.p.,,3,2,2,2,1,2,9,4,7,5,1,,1,1,4,1,1,,1,,0,47
2030,Fabricación de fibras sintéticas y artificiales,,3,,,,,2,1,,,,,,,,2,,,,,1,0,9
2100,"Fabricación de productos farmacéuticos, sustancias químicas medicinales y productos botánicos de uso farmacéutico",1,1,12,2,,3,28,9,6,19,11,,,,,2,2,1,,2,2,1,102
2212,Reencauche de llantas usadas,,,1,,,,,2,1,3,2,,,,,3,,,,,,0,12
2219,Fabricación de formas básicas de caucho y otros productos de caucho n.c.p.,,3,,,1,,,9,,8,1,,,,2,,,1,1,1,,0,27
2221,Fabricación de formas básicas de plástico,1,18,4,,1,3,5,28,3,21,9,2,,,4,4,2,1,,,,0,106
2229,Fabricación de artículos de plástico n.c.p.,1,18,15,6,11,6,15,66,15,42,15,3,,,4,2,10,1,4,1,1,1,237
2310,Fabricación de vidrio y productos de vidrio,1,2,8,1,2,,2,7,,13,4,2,,,1,2,4,1,,,,1,51
2391,Fabricación de productos refractarios,,,,,,,1,1,,,,,,,,,,1,,,,0,3
2392,Fabricación de materiales de arcilla para la construcción,8,2,4,,,,3,1,,3,,,,,,,1,,,,,0,22
2393,Fabricación de otros productos de cerámica y porcelana,,,,1,,,,,1,2,1,1,,,1,,1,,,,1,0,9
2394,"Fabricación de cemento, cal y yeso",,,1,,,2,7,,,2,1,,,,,,,,,,,0,13
2395,"Fabricación de artículos de hormigón, cemento y yeso",2,3,4,,4,,5,3,2,7,4,,,,2,1,3,2,3,,2,1,48
2396,"Corte, tallado y acabado de la piedra",1,8,,1,,,1,2,,6,5,1,,,2,3,2,1,,,,0,33
2399,Fabricación de otros productos minerales no metálicos n.c.p.,1,2,,1,,,,3,,,,,,,1,,,1,,,1,0,10
2410,Industrias básicas de hierro y de acero,,1,3,1,1,1,1,10,1,19,3,1,,,5,,1,1,2,,1,0,52
2421,Industrias básicas de metales preciosos,,,3,,,,3,,,5,,,,,,,,,,1,,0,12
2429,Industrias básicas de otros metales no ferrosos,,,,,,1,2,1,,1,1,,,,1,,,,,,,0,7
2431,Fundición de hierro y de acero,1,1,1,1,2,,1,1,,1,,,,,,,3,,1,,1,0,14
2432,Fundición de metales no ferrosos,1,,1,1,,,1,2,,4,,1,,,1,,,,1,,,0,13
2511,Fabricación de productos metálicos para uso estructural,7,32,37,19,18,15,16,54,14,107,19,18,1,7,31,9,8,15,7,5,20,2,461
2512,"Fabricación de tanques, depósitos y recipientes de metal, excepto los utilizados para el envase o el transporte de mercancías",,,1,,,1,,1,1,5,1,,,,,,,,1,,1,0,12
2513,"Fabricación de generadores de vapor, excepto calderas de agua caliente para calefacción central",,,1,1,,,,1,2,1,,,,,,,,,,,,0,6
2591,"Forja, prensado, estampado y laminado de metal, pulvimetalurgia",,2,1,2,1,1,1,6,2,12,1,1,,1,,,,2,,,,0,33
2592,"Tratamiento y revestimiento de metales, mecanizado",1,4,2,1,4,1,3,27,2,22,1,,,,1,2,1,,,1,,0,73
2593,"Fabricación de artículos de cuchillería, herramientas de mano y artículos de ferretería",,,2,,1,,,1,,5,1,,1,,,1,,,,,1,0,13
2599,Fabricación de otros productos elaborados de metal n.c.p.,4,21,20,3,18,5,16,91,5,60,18,1,,,7,3,1,7,,6,4,1,291
2610,Fabricación de componentes y tableros electrónicos,,1,3,,,,,6,1,3,3,,,,,,1,1,,,,0,19
2620,Fabricación de computadoras y de equipo periférico,,,,,,,,,,,,,,,,,,,,,1,0,1
2630,Fabricación de equipos de comunicación,,,1,1,,,,,,,,,,,,,,,,,,0,2
2640,Fabricación de aparatos electrónicos de consumo,,,,,,,1,,,,,,,,1,,,1,,,,0,3
2651,"Fabricación de equipo de medición, prueba, navegación y control",,1,1,1,,,1,2,1,6,,,,,,,,1,,,,0,14
2652,Fabricación de relojes,,1,,,,,1,,,,,,,,,,,,,,,0,2
2660,Fabricación de equipo de irradiación y equipo electrónico de uso médico y terapéutico,,,4,,,1,2,1,,,2,1,,,1,,,,,,,0,12
2670,Fabricación de instrumentos ópticos y equipo fotográfico,,,3,,,1,,,,12,,,,,1,,1,,,,,0,18
2711,"Fabricación de motores, generadores y transformadores eléctricos",,,1,1,,,1,,,4,1,,,1,,,,,,,1,0,10
2712,Fabricación de aparatos de distribución y control de la energía eléctrica,,2,,,2,,2,4,3,,2,,,,,,,,,,,0,15
2720,"Fabricación de pilas, baterías y acumuladores eléctricos",,,,,,,,,,,,,,,,,,,,,1,0,1
2731,Fabricación de hilos y cables eléctricos y de fibra óptica,,,1,,,,,1,,,,,,,,,,,,,,0,2
2732,Fabricación de dispositivos de cableado,,,,,,,1,1,,1,1,,,,,,,,,,,0,4
2740,Fabricación de equipos eléctricos de iluminación,,,4,1,,1,7,6,1,4,1,,,,1,,,,,,,0,26
2750,Fabricación de aparatos de uso doméstico,1,2,6,,1,1,3,2,,9,,,,,,,,,,,1,0,26
2790,Fabricación de otros tipos de equipo eléctrico n.c.p.,1,2,2,,,1,4,4,1,6,4,1,,,2,,,,,,,0,28
2811,"Fabricación de motores, turbinas, y partes para motores de combustión interna",,,,,,2,,,,2,,,,,,,,,,,,0,4
2812,Fabricación de equipos de potencia hidráulica y neumática,,1,,1,1,,,4,,4,1,,,,1,,,,,,,0,13
2813,"Fabricación de otras bombas, compresores, grifos y válvulas",,,,,1,,1,,1,2,,,,,,,,,,,1,0,6
2814,"Fabricación de cojinetes, engranajes, trenes de engranajes y piezas de transmisión",,,,,2,,,2,,,,,,1,,,,,,,,0,5
2815,"Fabricación de hornos, hogares y quemadores industriales",,1,1,,,,1,4,2,5,1,,,,1,,,1,,,,0,17
2816,Fabricación de equipo de elevación y manipulación,,,3,,1,,,3,1,4,1,,,,,1,,1,,,,0,15
2817,Fabricación de maquinaria y equipo de oficina (excepto computadoras y equipo periférico),,,,,,1,,1,,1,1,,,,,,,,,,,0,4
2818,Fabricación de herramientas manuales con motor,,,1,,,,,,,,,,,,,,,,,,,0,1
2819,Fabricación de otros tipos de maquinaria y equipo de uso general n.c.p.,,1,2,1,6,2,5,16,,16,8,,,,2,1,,,,,2,0,62
2821,Fabricación de maquinaria agropecuaria y forestal,,,1,,,,1,,1,1,1,,,,,1,,,,1,,0,7
2822,Fabricación de máquinas formadoras de metal y de máquinas herramienta,,,,,1,,1,3,,,,,,,,,1,,,,,0,6
2823,Fabricación de maquinaria para la metalurgia,,,,,,,,3,,,,,,,1,,,,,,,0,4
2824,Fabricación de maquinaria para explotación de minas y canteras y para obras de construcción,,,1,,,,2,1,,,2,,,1,1,,,,2,,,0,10
2825,"Fabricación de maquinaria para la elaboración de alimentos, bebidas y tabaco",,1,3,,3,,1,3,,5,,,,,,,,,,,,0,16
2826,"Fabricación de maquinaria para la elaboración de productos textiles, prendas de vestir y cueros",,,,1,,,1,3,1,4,,,,,,1,,,,,,0,11
2829,Fabricación de otros tipos de maquinaria y equipo de uso especial n.c.p.,,2,2,,5,,6,10,,6,3,,,,,,1,,,,1,0,36
2910,Fabricación de vehículos automotores y sus motores,,,,,,,2,3,,,,,,,,,,,,,,0,5
2920,"Fabricación de carrocerías para vehículos automotores, fabricación de remolques y semirremolques",,2,,,2,,,3,,2,2,,,,,,1,1,,,,0,13
2930,"Fabricación de partes, piezas (autopartes) y accesorios (lujos) para vehículos automotores",,3,4,1,5,1,4,13,4,29,4,,,,1,2,,3,1,1,2,0,78
3011,Construcción de barcos y de estructuras flotantes,,,,,,,1,,,,,,,,,,,,,,,0,1
3012,Construcción de embarcaciones de recreo y deporte,,,,1,,,,,,1,,,,,,,,,,,,0,2
3030,"Fabricación de aeronaves, naves espaciales y de maquinaria conexa",,,,,,,,1,,1,,,,,,,,,,,,0,2
3091,Fabricación de motocicletas,,,1,,,,1,1,,4,,,,,,,,,,,,0,7
3092,Fabricación de bicicletas y de sillas de ruedas para personas con discapacidad,,,2,,2,,3,1,1,3,2,,,,,,,,,,1,0,15
3099,Fabricación de otros tipos de equipo de transporte n.c.p.,,,1,,,,,1,,,,,,,,,,,,,,0,2
3110,Fabricación de muebles,8,43,63,19,14,10,37,63,29,119,40,11,,6,17,9,12,14,4,2,13,1,534
3120,Fabricación de colchones y somieres,,9,5,,6,4,,1,3,12,27,2,,1,3,,,4,1,,1,0,79
3210,"Fabricación de joyas, bisutería y artículos conexos",1,8,18,8,6,3,41,8,8,129,25,1,,,5,5,1,5,4,6,6,0,288
3220,Fabricación de instrumentos musicales,1,,1,1,,1,,1,,2,,,,,,,,,,,,0,7
3230,Fabricación de artículos y equipo para la práctica del deporte,2,,5,1,,1,6,1,1,6,1,2,,,,,,,,1,1,0,28
3240,"Fabricación de juegos, juguetes y rompecabezas",,1,4,3,,4,3,,2,3,5,2,,,,,,1,,1,,0,29
3250,"Fabricación de instrumentos, aparatos y materiales médicos y odontológicos (incluido mobiliario)",1,2,40,9,5,1,19,7,5,55,33,4,,2,5,3,5,2,2,,7,0,207
3290,Otras industrias manufactureras n.c.p.,,11,18,7,7,14,27,35,15,60,15,7,,2,8,6,4,3,1,3,5,0,248
3311,Mantenimiento y reparación especializado de productos elaborados en metal,1,8,13,4,6,2,5,12,6,31,10,3,,3,1,3,3,6,,,1,0,118
3312,Mantenimiento y reparación especializado de maquinaria y equipo,7,20,48,23,33,21,31,68,22,124,54,10,1,3,31,23,4,18,4,3,17,2,567
3313,Mantenimiento y reparación especializado de equipo electrónico y óptico,,1,11,2,3,1,5,5,9,16,13,1,,,4,,1,2,,1,1,0,76
3314,Mantenimiento y reparación especializado de equipo eléctrico,1,5,10,6,4,9,7,9,5,21,11,2,,1,4,,3,2,4,,6,1,111
3315,"Mantenimiento y reparación especializado de equipo de transporte, excepto los vehículos automotores, motocicletas y bicicletas",,2,4,,2,,5,4,1,4,1,,,,,,,1,,4,1,0,29
3319,Mantenimiento y reparación de otros tipos de equipos y sus componentes n.c.p.,,3,11,1,3,3,3,7,2,17,2,2,,1,5,1,3,2,1,,2,0,69
3320,Instalación especializada de maquinaria y equipo industrial,,1,7,2,2,2,9,9,3,7,4,2,,,4,2,,1,,2,,1,58
3511,Generación de energía eléctrica,1,2,7,3,3,2,136,3,1,4,15,1,,,1,,,1,,3,4,1,188
3512,Transmisión de energía eléctrica,,,1,,,,3,4,,1,1,,,,,,,,,,1,0,11
3513,Distribución de energía eléctrica,,,,,,1,2,,,,,,,,1,,,,,,,0,4
3514,Comercialización de energía eléctrica,,,1,1,,,22,,1,,2,,,,,,,1,,,,0,28
3520,"Producción de gas, distribución de combustibles gaseosos por tuberías",,2,1,,,,1,,3,,,,,,,,,,1,,1,0,9
3530,Suministro de vapor y aire acondicionado,,,,,,1,,,,1,,,,,2,1,,1,,,,0,6
3600,"Captación, tratamiento y distribución de agua",,,2,1,4,1,5,2,3,1,10,,,,1,,,,,1,1,1,33
3700,Evacuación y tratamiento de aguas residuales,,,4,,,1,2,3,2,1,4,,,,1,1,,,,,,0,19
3811,Recolección de desechos no peligrosos,1,5,3,1,,1,4,8,1,11,2,1,,1,1,,,3,2,1,,0,46
3812,Recolección de desechos peligrosos,,1,,,,,,,,,1,,,,,,,,,,,0,2
3821,Tratamiento y disposición de desechos no peligrosos,1,1,1,,1,,5,,,,3,,,,,2,,,,,2,0,16
3822,Tratamiento y disposición de desechos peligrosos,,,1,,,,2,1,,1,1,,,,,,,,,,,0,6
3830,Recuperación de materiales,1,41,9,8,9,7,6,21,8,64,7,8,,8,9,3,6,6,16,2,3,1,243
3900,Actividades de saneamiento ambiental y otros servicios de gestión de desechos,1,1,3,1,2,1,4,1,1,2,4,,,1,2,,,,1,2,2,0,29
4111,Construcción de edificios residenciales,36,67,145,83,52,44,381,46,74,160,199,55,,31,73,35,47,65,42,31,81,12,1759
4112,Construcción de edificios no residenciales,4,4,25,5,6,7,72,7,5,28,21,9,,2,7,3,8,3,3,5,11,0,235
4210,Construcción de carreteras y vías de ferrocarril,,1,16,7,4,3,24,5,5,22,5,2,,3,5,3,,1,1,1,5,0,113
4220,Construcción de proyectos de servicio público,,2,9,5,3,2,12,4,12,8,11,,,,7,2,1,2,1,1,4,0,86
4290,Construcción de otras obras de ingeniería civil,21,33,160,59,39,34,269,71,74,126,163,30,1,21,59,31,23,46,28,20,58,9,1375
4311,Demolición,1,1,1,2,3,,4,,1,1,1,1,,,1,1,,1,,,1,1,21
4312,Preparación del terreno,1,4,18,9,1,2,29,3,5,17,10,1,,6,2,,,5,3,3,4,1,124
4321,Instalaciones eléctricas,7,26,57,35,31,33,51,33,28,45,66,24,,16,25,8,18,26,24,10,27,3,593
4322,"Instalaciones de fontanería, calefacción y aire acondicionado",3,11,38,25,22,20,18,24,12,35,11,14,,8,21,10,13,11,10,2,17,3,328
4329,Otras instalaciones especializadas,2,3,13,6,7,7,11,10,7,12,11,8,,2,11,2,4,3,5,2,6,0,132
4330,Terminación y acabado de edificios y obras de ingeniería civil,24,63,111,70,46,50,83,51,43,87,92,55,,46,67,27,31,58,35,14,61,10,1124
4390,Otras actividades especializadas para la construcción de edificios y obras de ingeniería civil,14,22,68,23,12,18,92,30,31,40,59,13,,13,27,19,13,11,11,9,31,3,559
4511,Comercio de vehículos automotores nuevos,2,1,7,5,1,,45,5,1,19,5,1,,,2,1,1,,1,3,,1,101
4512,Comercio de vehículos automotores usados,2,6,31,17,5,5,169,17,11,47,78,6,,,7,2,3,3,3,3,6,4,425
4520,Mantenimiento y reparación de vehículos automotores,13,112,108,54,88,21,107,107,61,400,150,18,2,10,57,13,13,25,18,7,22,3,1409
4530,"Comercio de partes, piezas (autopartes) y accesorios (lujos) para vehículos automotores",6,55,95,25,65,18,80,55,32,651,116,12,1,6,27,9,3,16,8,10,13,5,1308
4541,"Comercio de motocicletas y de sus partes, piezas y accesorios",,28,48,10,17,15,26,14,15,199,60,11,1,7,14,9,13,8,8,2,13,1,519
4542,Mantenimiento y reparación de motocicletas y de sus partes y piezas,3,27,47,20,20,15,6,14,23,81,31,24,,7,16,10,9,11,10,6,8,0,388
4610,Comercio al por mayor a cambio de una retribución o por contrata,10,,24,6,3,2,78,19,11,29,19,2,,1,4,2,3,2,,8,5,1,229
4620,"Comercio al por mayor de materias primas agropecuarias, animales vivos",3,6,28,8,11,4,63,14,12,31,39,3,2,3,6,5,4,3,2,7,7,3,264
4631,Comercio al por mayor de productos alimenticios,8,29,65,29,23,6,136,38,25,64,67,8,1,6,22,9,3,16,9,8,15,4,591
4632,Comercio al por mayor de bebidas y tabaco,3,7,17,4,2,4,48,3,4,17,10,1,,1,2,1,,4,1,3,2,0,134
4641,"Comercio al por mayor de productos textiles, productos confeccionados para uso doméstico",1,1,26,5,3,2,44,24,11,116,25,2,,,6,,2,1,1,1,6,2,279
4642,Comercio al por mayor de prendas de vestir,9,10,23,13,10,6,52,21,10,128,34,5,,7,10,6,2,5,6,4,11,1,373
4643,Comercio al por mayor de calzado,1,3,3,2,,,7,3,,54,6,1,,,3,,,,,2,4,0,89
4644,Comercio al por mayor de aparatos y equipo de uso doméstico,,2,3,,1,1,9,3,7,38,23,1,,,2,,1,,2,2,,1,96
4645,"Comercio al por mayor de productos farmacéuticos, medicinales, cosméticos y de tocador",7,16,61,17,13,4,124,49,36,166,107,6,,1,10,12,4,12,2,5,15,1,668
4649,Comercio al por mayor de otros utensilios domésticos n.c.p.,,4,23,5,2,5,16,10,6,114,20,1,,,4,,1,1,2,,4,0,218
4651,"Comercio al por mayor de computadores, equipo periférico y programas de informática",,5,7,2,,1,32,4,9,11,5,,,,4,2,,,1,1,4,0,88
4652,"Comercio al por mayor de equipo, partes y piezas electrónicos y de telecomunicaciones",3,3,25,6,2,4,37,16,11,67,31,2,,,3,2,2,4,1,1,4,1,225
4653,Comercio al por mayor de maquinaria y equipo agropecuarios,,1,8,1,,1,14,8,6,17,1,,,,2,,,1,,1,,0,61
4659,Comercio al por mayor de otros tipos de maquinaria y equipo n.c.p.,4,10,68,10,9,6,79,56,23,89,63,4,,2,11,2,3,4,4,9,8,0,464
4661,"Comercio al por mayor de combustibles sólidos, líquidos, gaseosos y productos conexos",,3,2,3,5,1,6,13,7,11,4,1,,2,2,1,,4,,,,0,65
4662,Comercio al por mayor de metales y productos metalíferos,1,3,20,6,3,2,92,33,6,27,16,2,,,1,,1,,3,5,5,0,226
4663,"Comercio al por mayor de materiales de construcción, artículos de ferretería, pinturas, productos de vidrio, equipo y materiales de fontanería y calefacción",9,25,62,12,15,11,69,63,27,192,53,8,1,3,18,9,9,9,4,7,11,4,621
4664,"Comercio al por mayor de productos químicos básicos, cauchos y plásticos en formas primarias y productos químicos de uso agropecuario",,5,14,2,3,2,33,23,11,31,17,1,,,8,1,2,1,,1,1,0,156
4665,"Comercio al por mayor de desperdicios, desechos y chatarra",2,34,8,2,7,4,5,13,5,48,14,3,,2,8,2,3,1,11,,4,1,177
4669,Comercio al por mayor de otros productos n.c.p.,5,7,56,10,12,5,61,36,15,125,37,3,,2,10,6,2,8,1,2,11,3,417
4690,Comercio al por mayor no especializado,12,19,86,17,13,10,147,74,33,296,78,6,,1,15,12,2,8,2,6,12,3,852
4711,"Comercio al por menor en establecimientos no especializados con surtido compuesto principalmente por alimentos, bebidas (alcohólicas y no alcohólicas) o tabaco",58,338,404,296,275,332,134,252,215,454,266,310,11,198,288,185,114,243,195,50,231,13,4862
